Name,Founded,Type(Oracle/Messaging/Bridge),KeyNotes,SecurityAssumptions,OfficialURL
Chainlink,2019-05,Oracle,Decentralized oracle network for data feeds,Relies on node operators and crypto-economic incentives,https://chain.link
Chainlink CCIP,2023-07,Messaging,Cross-chain messaging and token transfer protocol,Relies on Chainlink oracle network and risk management network,https://chain.link/ccip
LayerZero,2022-03,Messaging,Omnichain messaging protocol using oracle + relayer,Security depends on oracle and relayer configuration,https://layerzero.network
Wormhole,2021-09,Messaging,Cross-chain messaging bridge with guardian network,Security depends on guardian network quorum,https://wormhole.com
Axelar,2022-01,Messaging,Cross-chain messaging via validator network,Security depends on Axelar validator set,https://axelar.network
