Name,Founded,Type(Fiat-backed/Crypto-collateralized/Synthetic),Issuer,PrimaryChains,KeyNotes,MetricSourceURL,SnapshotDate,OfficialURL
USDT,2014-10,Fiat-backed,Tether,Ethereum; TRON; Solana,Widely used fiat-backed stablecoin,https://defillama.com/stablecoins,2026-02-04,https://tether.to
USDC,2018-09,Fiat-backed,Circle,Ethereum; Solana; Base,Fully reserved fiat-backed stablecoin,https://defillama.com/stablecoins,2026-02-04,https://www.circle.com/usdc
DAI,2019-11,Crypto-collateralized,MakerDAO,Ethereum,Crypto-collateralized stablecoin from Maker,https://defillama.com/stablecoins,2026-02-04,https://makerdao.com
LUSD,2021-04,Crypto-collateralized,Liquity,Ethereum,Crypto-collateralized stablecoin by Liquity,https://defillama.com/stablecoins,2026-02-04,https://liquity.org
USDe,2024-02,Synthetic,Ethena,Ethereum,Synthetic stablecoin using delta-hedging,https://defillama.com/stablecoins,2026-02-04,https://ethena.fi
USDD,2022-05,Synthetic,TRON DAO Reserve,TRON; Ethereum,Synthetic stablecoin for TRON ecosystem,https://defillama.com/stablecoins,2026-02-04,https://usdd.io
